{
  "contract_version": "1.0.0",
  "run_id": "fixture-planned-run",
  "objective": "Exercise the planned safe-change shape.",
  "mode": "dry-run",
  "status": "planned",
  "target": {
    "kind": "provider-resource",
    "locator": "test/resource-123",
    "environment": "test",
    "resolved_identity": {"provider_id": "resource-123", "logical_name": "fixture-resource"}
  },
  "scope": {
    "includes": [{"id": "resource-123"}],
    "excludes": [{"id": "resource-999"}]
  },
  "authority": {
    "read": "allowed",
    "write": "approval-required",
    "external": "approval-required",
    "live": "forbidden",
    "destructive": "forbidden",
    "privileged": "forbidden"
  },
  "snapshots": {
    "before": {
      "artifact_ref": "artifacts/fixture-before.json",
      "digest": "sha256:before",
      "captured_at": "2026-08-06T00:00:00Z",
      "scope": {"includes": ["resource-123"]}
    },
    "after": null
  },
  "plan": {
    "generated_from": "artifacts/fixture-before.json",
    "operations": [
      {
        "id": "op-update-resource-123",
        "action": "update",
        "target": "resource-123",
        "expected_effect": "Set the fixture resource to the desired test configuration.",
        "destructive": false,
        "reversible": true,
        "preconditions": [{"description": "The before snapshot still matches the target.", "status": "passed"}]
      }
    ]
  },
  "dry_run": {
    "status": "pending",
    "command": null,
    "exit_code": null,
    "predicted_operation_ids": [],
    "invariants": [],
    "side_effects_detected": null
  },
  "approval": {
    "required_dimensions": ["write", "external"],
    "state": "not-requested",
    "scope": null,
    "observed_at": null
  },
  "apply_receipts": [],
  "verification": {"postconditions": [], "unchanged_conditions": [], "omissions": []},
  "rollback": {"condition": null, "procedure": null, "required_dimensions": [], "status": "not-planned"},
  "blockers": [],
  "next_action": "Run the side-effect-free dry run."
}
